{"schemaVersion":1,"id":"editorial-room-chat","name":"公众号编辑会","version":"1.6.0","kind":"stage","entryPoints":[],"contentTypes":[],"inputContract":"event_fact_cards","outputContract":"editorial_decision","requiredCapabilities":[],"optionalCapabilities":["cap_filesystem_project_read","cap_content_url_fetch","cap_content_passage_retrieve","cap_content_web_search","cap_content_news_search"],"compatibleApp":">=0.1.0","source":{"type":"builtin","url":""}}
