{"schemaVersion":1,"id":"discussion-researcher","name":"讨论研判编辑","version":"1.2.0","kind":"stage","entryPoints":[],"contentTypes":[],"inputContract":"topk_event_research_input","outputContract":"discussion_research_markdown","requiredCapabilities":[],"optionalCapabilities":["content.web.search"],"compatibleApp":">=0.1.0","source":{"type":"builtin","url":""}}
