{"schemaVersion":1,"id":"wechat-mp-daily","name":"批次早报","version":"1.0.0","kind":"writer","entryPoints":["batch-daily"],"contentTypes":["daily"],"inputContract":"event_fact_cards","outputContract":"wechat_markdown","requiredCapabilities":[],"optionalCapabilities":["cap_content_url_fetch"],"compatibleApp":">=0.1.0","source":{"type":"builtin","url":""}}
