{"schemaVersion":1,"id":"wechat-mp-personal-writing","name":"心得经验文章","version":"1.0.0","kind":"writer","entryPoints":["independent-writing"],"contentTypes":["experience"],"inputContract":"personal_fact_base","outputContract":"wechat_markdown","requiredCapabilities":[],"optionalCapabilities":[],"compatibleApp":">=0.1.0","source":{"type":"builtin","url":""}}
