{"schemaVersion":1,"id":"html-pages-to-images","name":"HTML 页面截图","version":"1.0.0","kind":"stage","entryPoints":["social-tool","social-custom","social-event"],"contentTypes":["social_cards"],"inputContract":"card_html","outputContract":"card_images","requiredCapabilities":[],"optionalCapabilities":[],"compatibleApp":">=0.1.0","source":{"type":"builtin","url":""}}
