{"schemaVersion":1,"id":"social-card-ai-visual-generator","name":"社交卡 AI 视觉生成","version":"1.0.0","kind":"stage","entryPoints":["social-tool"],"contentTypes":["social_cards"],"inputContract":"social_card_storyboard","outputContract":"social_card_delivery","requiredCapabilities":[],"optionalCapabilities":[],"compatibleApp":">=0.1.0","source":{"type":"builtin","url":""}}
