{"schemaVersion":1,"id":"wechat-mp-tech-deep","name":"技术深解文章","version":"1.0.0","kind":"writer","entryPoints":["hotspot-article"],"contentTypes":["tech_deep"],"inputContract":"article_fact_base","outputContract":"wechat_markdown","requiredCapabilities":[],"optionalCapabilities":["content.url.fetch"],"compatibleApp":">=0.1.0","source":{"type":"builtin","url":""}}
