{"schemaVersion":1,"id":"tutorial-chat","name":"自主写作策划对话","version":"1.0.0","kind":"stage","entryPoints":[],"contentTypes":[],"inputContract":"independent_writing_draft","outputContract":"brief_updates","requiredCapabilities":[],"optionalCapabilities":["filesystem.project.read","content.url.fetch","content.web.search","content.news.search","content.document.search","content.passage.retrieve"],"compatibleApp":">=0.1.0","source":{"type":"builtin","url":""}}
