{"schemaVersion":1,"id":"wechat-article-typeset","name":"公众号文章排版","version":"1.0.0","kind":"typesetter","entryPoints":["wechat-typeset"],"contentTypes":["wechat_article"],"inputContract":"wechat_markdown","outputContract":"wechat_html","requiredCapabilities":[],"optionalCapabilities":["diagram.mermaid.render","diagram.echarts.render","image.cdn.upload"],"compatibleApp":">=0.1.0","source":{"type":"builtin","url":""}}
