{"schemaVersion":1,"id":"wechat-echarts-blocks-to-images","name":"ECharts 图表转图","version":"1.0.0","kind":"stage","entryPoints":["wechat-typeset"],"contentTypes":["wechat_article"],"inputContract":"rendered_markdown","outputContract":"rendered_markdown","requiredCapabilities":["diagram.echarts.render"],"optionalCapabilities":[],"compatibleApp":">=0.1.0","source":{"type":"builtin","url":""}}
