{"schemaVersion":1,"id":"article-image-placeholders","name":"文章配图占位规划","version":"1.0.0","kind":"image-planner","entryPoints":["hotspot-article","independent-writing","batch-daily"],"contentTypes":["article"],"inputContract":"wechat_markdown","outputContract":"image_plan","requiredCapabilities":[],"optionalCapabilities":[],"compatibleApp":">=0.1.0","source":{"type":"builtin","url":""}}
