{"schemaVersion":1,"id":"wechat-mp-deep-dive","name":"深度分析文章","version":"1.1.0","kind":"writer","entryPoints":["hotspot-article"],"contentTypes":["deep_dive"],"inputContract":"article_fact_base","outputContract":"wechat_markdown","requiredCapabilities":[],"optionalCapabilities":["content.url.fetch"],"compatibleApp":">=0.1.0","source":{"type":"builtin","url":""}}
