{"schemaVersion":1,"id":"custom-social-chat","name":"图文策划对话","version":"1.0.0","kind":"stage","entryPoints":[],"contentTypes":[],"inputContract":"custom_social_draft","outputContract":"brief_updates","requiredCapabilities":[],"optionalCapabilities":["filesystem.project.read","content.url.fetch","content.web.search","content.news.search","content.document.search","content.repository.inspect","content.passage.retrieve"],"compatibleApp":">=0.1.0","source":{"type":"builtin","url":""}}
