{"schemaVersion":1,"id":"event-card-storyboard","name":"事件图文故事板","version":"1.3.0","kind":"storyboard","entryPoints":["social-event"],"contentTypes":["event"],"inputContract":"social_card_fact_base","outputContract":"social_card_storyboard","requiredCapabilities":[],"optionalCapabilities":[],"compatibleApp":">=0.1.0","source":{"type":"builtin","url":""}}
