{"schemaVersion":1,"id":"upyun-upload-image","name":"图片 CDN 上传","version":"1.0.0","kind":"stage","entryPoints":["wechat-typeset"],"contentTypes":["wechat_article"],"inputContract":"local_image","outputContract":"cdn_image","requiredCapabilities":["image.cdn.upload"],"optionalCapabilities":[],"compatibleApp":">=0.1.0","source":{"type":"builtin","url":""}}
